id,post_message,post_image_path,post_user_fk,created_at
292b9e1815b6eb51775e0fd1906c95d7a714970773a130787b,"Nullam sit amet turpis elementum ligula vehicula consequat. Morbi a ipsum. Integer a nibh. In quis justo. Maecenas rhoncus aliquam lacus. Morbi quis tortor id nulla ultrices aliquet. Maecenas leo odio, condimentum id, luctus nec, molestie sed, justo.",http://dummyimage.com/240x100.png/5fa2dd/ffffff,9b66842d0782467e5ef6fdd1ae53eb3cca595ea160b084c135,2024-12-22 21:27:03
af1a994ce902299e2496e7a90b28ff8ca9c4210c9f7d78aca0,Pellentesque eget nunc. Donec quis orci eget orci vehicula condimentum.,http://dummyimage.com/144x100.png/5fa2dd/ffffff,d8af371ef4e27e56f5d7bffce8aa381bd67507983d52f931f7,2024-12-09 19:41:03
dd3fd274e4ed6d7069a7582427f4141b3137fffa6014b57cb6,"Integer non velit. Donec diam neque, vestibulum eget, vulputate ut, ultrices vel, augue. Vestibulum ante ipsum primis in faucibus orci luctus et ultrices posuere cubilia Curae; Donec pharetra, magna vestibulum aliquet ultrices, erat tortor sollicitudin mi, sit amet lobortis sapien sapien non mi. Integer ac neque. Duis bibendum. Morbi non quam nec dui luctus rutrum. Nulla tellus. In sagittis dui vel nisl.",http://dummyimage.com/108x100.png/5fa2dd/ffffff,fa24d1fc40c3d92d33ea9bb40f87694b1d377558e0cc5a449f,2025-10-05 09:18:41
82c56e7a3e5636f57f7cc9a1c54b444a3afa1f96ab64d323e0,"Duis aliquam convallis nunc. Proin at turpis a pede posuere nonummy. Integer non velit. Donec diam neque, vestibulum eget, vulputate ut, ultrices vel, augue. Vestibulum ante ipsum primis in faucibus orci luctus et ultrices posuere cubilia Curae; Donec pharetra, magna vestibulum aliquet ultrices, erat tortor sollicitudin mi, sit amet lobortis sapien sapien non mi. Integer ac neque. Duis bibendum. Morbi non quam nec dui luctus rutrum.",http://dummyimage.com/176x100.png/5fa2dd/ffffff,fcaddccf5a2990bd290ae0e5ec12b90b7be8bf28b54a0e3202,2025-01-09 10:41:13
d4d95f87d0843e419f6fe580c73661678c17618e8eb62fe672,"Nam nulla. Integer pede justo, lacinia eget, tincidunt eget, tempus vel, pede. Morbi porttitor lorem id ligula. Suspendisse ornare consequat lectus. In est risus, auctor sed, tristique in, tempus sit amet, sem. Fusce consequat. Nulla nisl.",http://dummyimage.com/145x100.png/dddddd/000000,fcaddccf5a2990bd290ae0e5ec12b90b7be8bf28b54a0e3202,2025-10-24 09:57:53
0431111e27ea5cd5fa7be275579d9748f41404bcb547cef0c2,"Aenean fermentum. Donec ut mauris eget massa tempor convallis. Nulla neque libero, convallis eget, eleifend luctus, ultricies eu, nibh. Quisque id justo sit amet sapien dignissim vestibulum. Vestibulum ante ipsum primis in faucibus orci luctus et ultrices posuere cubilia Curae; Nulla dapibus dolor vel est. Donec odio justo, sollicitudin ut, suscipit a, feugiat et, eros. Vestibulum ac est lacinia nisi venenatis tristique. Fusce congue, diam id ornare imperdiet, sapien urna pretium nisl, ut volutpat sapien arcu sed augue. Aliquam erat volutpat.",http://dummyimage.com/222x100.png/cc0000/ffffff,fa24d1fc40c3d92d33ea9bb40f87694b1d377558e0cc5a449f,2025-10-19 14:12:05
65268c85e46a87709074433c655e06c2f76c85cb6d88ec03e8,"Fusce congue, diam id ornare imperdiet, sapien urna pretium nisl, ut volutpat sapien arcu sed augue. Aliquam erat volutpat. In congue. Etiam justo.",http://dummyimage.com/205x100.png/dddddd/000000,bcd377e625149c1054ab2fda56c417401faecde58f5639222b,2025-09-19 23:19:57
3122e57ce9ebc7ccd3bcb4e5ef8af1b410559ba0a48c15d5dd,"Cras mi pede, malesuada in, imperdiet et, commodo vulputate, justo. In blandit ultrices enim. Lorem ipsum dolor sit amet, consectetuer adipiscing elit. Proin interdum mauris non ligula pellentesque ultrices. Phasellus id sapien in sapien iaculis congue. Vivamus metus arcu, adipiscing molestie, hendrerit at, vulputate vitae, nisl.",http://dummyimage.com/129x100.png/cc0000/ffffff,237f69989b148d2a03ec586b5978f17f46423aa1b2d00b39c2,2025-02-12 12:09:15
a894fa2bee87ff25161d673c8e79896c509e9adcf3c8d2041d,"Nullam varius. Nulla facilisi. Cras non velit nec nisi vulputate nonummy. Maecenas tincidunt lacus at velit. Vivamus vel nulla eget eros elementum pellentesque. Quisque porta volutpat erat. Quisque erat eros, viverra eget, congue eget, semper rutrum, nulla. Nunc purus. Phasellus in felis. Donec semper sapien a libero.",http://dummyimage.com/190x100.png/5fa2dd/ffffff,f245b39088dd3cf74abb5c118b959341cc3bff78df40be1ad6,2024-12-22 04:43:41
41538bf67f58d2953028c6096dfad6b2d8db5ad495dbb111e2,"Proin leo odio, porttitor id, consequat in, consequat ut, nulla. Sed accumsan felis.",http://dummyimage.com/226x100.png/ff4444/ffffff,bcd377e625149c1054ab2fda56c417401faecde58f5639222b,2025-06-29 18:23:36
915baface9f18986fa8c92a13f3d2922f7d4b0fd7197fafa39,"Morbi odio odio, elementum eu, interdum eu, tincidunt in, leo. Maecenas pulvinar lobortis est.",http://dummyimage.com/188x100.png/5fa2dd/ffffff,5f103fde1336a9c3dcaab8b5166cf9cb8e953d3929b6dc8a10,2025-01-29 01:28:08
55b454249c16d9784b751dfe201bc510012804f6615b55edb3,"Proin risus. Praesent lectus. Vestibulum quam sapien, varius ut, blandit non, interdum in, ante. Vestibulum ante ipsum primis in faucibus orci luctus et ultrices posuere cubilia Curae; Duis faucibus accumsan odio. Curabitur convallis. Duis consequat dui nec nisi volutpat eleifend. Donec ut dolor. Morbi vel lectus in quam fringilla rhoncus. Mauris enim leo, rhoncus sed, vestibulum sit amet, cursus id, turpis.",http://dummyimage.com/219x100.png/dddddd/000000,1b41d5dfe9272f5c0121e0fb7a53cb29d4a604cf29eaa4d5de,2025-10-09 21:23:11
92bfb5b5988fec366b95b22c6f70ca194b517448a3df9ed1ff,"Aliquam quis turpis eget elit sodales scelerisque. Mauris sit amet eros. Suspendisse accumsan tortor quis turpis. Sed ante. Vivamus tortor. Duis mattis egestas metus. Aenean fermentum. Donec ut mauris eget massa tempor convallis. Nulla neque libero, convallis eget, eleifend luctus, ultricies eu, nibh. Quisque id justo sit amet sapien dignissim vestibulum.",http://dummyimage.com/164x100.png/5fa2dd/ffffff,85f927461923e2cc7e83136a05863b162842a0ad83b8f46b94,2025-06-20 20:19:56
a6e378f8bfa9dbabf143117373cf6c54c2de927a772eed2d55,Sed vel enim sit amet nunc viverra dapibus. Nulla suscipit ligula in lacus.,http://dummyimage.com/154x100.png/dddddd/000000,79ce54ab004de901e91773c169cfda91aad811d0fba7b73442,2025-02-25 02:46:49
1fca8b09c020d09e9442403c813f54aa133f0269770822a3fa,Integer ac leo.,http://dummyimage.com/188x100.png/cc0000/ffffff,1d732af3da3978b01b0cacdd3a7d3a7856b2134b18a9e08140,2025-07-31 11:45:47
c68352aaf6bc1ddd19fdc9dc34ad1c93765938aad32d8b22f4,"Phasellus id sapien in sapien iaculis congue. Vivamus metus arcu, adipiscing molestie, hendrerit at, vulputate vitae, nisl.",http://dummyimage.com/187x100.png/cc0000/ffffff,33fa499e153293f2a944b2aa8dd346b0eb3e52e50d3358030f,2025-09-20 10:06:35
7142458a0096a2cdb4bbbb67f95dfd80b81bbd5b5bb3e37ae4,"Pellentesque eget nunc. Donec quis orci eget orci vehicula condimentum. Curabitur in libero ut massa volutpat convallis. Morbi odio odio, elementum eu, interdum eu, tincidunt in, leo. Maecenas pulvinar lobortis est.",http://dummyimage.com/184x100.png/ff4444/ffffff,d8af371ef4e27e56f5d7bffce8aa381bd67507983d52f931f7,2024-12-09 13:40:53
bbd80632053549124e0d90b1d585de28337dfa5819d50a8363,"Cras mi pede, malesuada in, imperdiet et, commodo vulputate, justo.",http://dummyimage.com/147x100.png/ff4444/ffffff,6dbe6b5a8cd69aef2cb02c20b62849837d0b262e70400bcfe7,2025-06-10 00:28:23
68adfed5597ec31853f548ae9af8b34a6644023eac453290b8,Duis bibendum.,http://dummyimage.com/109x100.png/5fa2dd/ffffff,1b5a9658d09315a6dc1c002efa003c527d572791463929e01c,2025-09-16 02:35:04
76595749edc08c81f309c4a2b85c650252a611e510638fe1f1,Vestibulum rutrum rutrum neque.,http://dummyimage.com/222x100.png/5fa2dd/ffffff,540c6c2fe7b0d9c093b4f6dc2762c045e32e7d66e0a8b5f780,2024-12-26 04:47:59
05fb282e51ed4a122bf112014dbefeb6a9b0570f201cd3071f,"Quisque id justo sit amet sapien dignissim vestibulum. Vestibulum ante ipsum primis in faucibus orci luctus et ultrices posuere cubilia Curae; Nulla dapibus dolor vel est. Donec odio justo, sollicitudin ut, suscipit a, feugiat et, eros.",http://dummyimage.com/229x100.png/5fa2dd/ffffff,bcd377e625149c1054ab2fda56c417401faecde58f5639222b,2024-12-22 15:51:56
07dde72ad13e26bd5b0e4022837e82e9640b2ff9c5eba1f0f4,"Phasellus in felis. Donec semper sapien a libero. Nam dui. Proin leo odio, porttitor id, consequat in, consequat ut, nulla. Sed accumsan felis.",http://dummyimage.com/170x100.png/5fa2dd/ffffff,1b5a9658d09315a6dc1c002efa003c527d572791463929e01c,2025-06-08 05:17:56
feb9d5d5da0a7a914dc96b0eca3893e5165242638e11336493,"In blandit ultrices enim. Lorem ipsum dolor sit amet, consectetuer adipiscing elit. Proin interdum mauris non ligula pellentesque ultrices. Phasellus id sapien in sapien iaculis congue. Vivamus metus arcu, adipiscing molestie, hendrerit at, vulputate vitae, nisl. Aenean lectus. Pellentesque eget nunc. Donec quis orci eget orci vehicula condimentum. Curabitur in libero ut massa volutpat convallis.",http://dummyimage.com/180x100.png/cc0000/ffffff,988d0f89596705e72390b7a8a11a66ae8b190a31a4754ae433,2025-03-23 02:04:24
96736de9364686a3710b7d79d00da7d06d7e9ec7449c5cee61,"Nunc rhoncus dui vel sem. Sed sagittis. Nam congue, risus semper porta volutpat, quam pede lobortis ligula, sit amet eleifend pede libero quis orci. Nullam molestie nibh in lectus. Pellentesque at nulla. Suspendisse potenti. Cras in purus eu magna vulputate luctus. Cum sociis natoque penatibus et magnis dis parturient montes, nascetur ridiculus mus.",http://dummyimage.com/146x100.png/5fa2dd/ffffff,90d75eb456b6c9b027cd9f566213f9ade22325f1b2cc24c84f,2025-04-28 18:10:36
e7beefddced1572fb111ca1f5be9d713db501c928d7a8954f9,"Cras pellentesque volutpat dui. Maecenas tristique, est et tempus semper, est quam pharetra magna, ac consequat metus sapien ut nunc. Vestibulum ante ipsum primis in faucibus orci luctus et ultrices posuere cubilia Curae; Mauris viverra diam vitae quam. Suspendisse potenti. Nullam porttitor lacus at turpis. Donec posuere metus vitae ipsum. Aliquam non mauris. Morbi non lectus. Aliquam sit amet diam in magna bibendum imperdiet.",http://dummyimage.com/191x100.png/dddddd/000000,052827b0ebd083339b6432c39957ed7cc0b0478fafec13a1f1,2025-02-09 19:05:38
ad6c6a1a5889b89c33fbdd2be48f1885c5386a1cf71e880efa,Mauris lacinia sapien quis libero.,http://dummyimage.com/164x100.png/ff4444/ffffff,bcd377e625149c1054ab2fda56c417401faecde58f5639222b,2025-02-20 22:33:43
c0ce82616971fe1acd2aa64c4d306c584ba90384002e4f0521,"In hac habitasse platea dictumst. Morbi vestibulum, velit id pretium iaculis, diam erat fermentum justo, nec condimentum neque sapien placerat ante. Nulla justo.",http://dummyimage.com/191x100.png/cc0000/ffffff,b2e83e280060175bed4f52449075c5aa67af6ca0faf4a031b4,2024-12-25 06:00:37
29dba4047d4579d83f5a0313221c9cac2d711268390fce0e5c,"In tempor, turpis nec euismod scelerisque, quam turpis adipiscing lorem, vitae mattis nibh ligula nec sem. Duis aliquam convallis nunc. Proin at turpis a pede posuere nonummy. Integer non velit.",http://dummyimage.com/125x100.png/5fa2dd/ffffff,06a170e099af36250573dd01e4399fbe46d6522b52f50092f8,2025-03-29 20:34:18
44378849b4d7fe594835d0c3a6c6a53bfbe887f5993139f93f,"Nam nulla. Integer pede justo, lacinia eget, tincidunt eget, tempus vel, pede.",http://dummyimage.com/248x100.png/5fa2dd/ffffff,bcd377e625149c1054ab2fda56c417401faecde58f5639222b,2025-01-07 00:16:25
0866259cbc8fbdcc63569b9a6559752363ef5dbb09e1155d84,"Integer ac leo. Pellentesque ultrices mattis odio. Donec vitae nisi. Nam ultrices, libero non mattis pulvinar, nulla pede ullamcorper augue, a suscipit nulla elit ac nulla. Sed vel enim sit amet nunc viverra dapibus. Nulla suscipit ligula in lacus.",http://dummyimage.com/243x100.png/dddddd/000000,90d75eb456b6c9b027cd9f566213f9ade22325f1b2cc24c84f,2025-11-30 23:49:26
da7f0a310bd436b15b14ddad420b11b804f499a36e6a8584f4,"Pellentesque eget nunc. Donec quis orci eget orci vehicula condimentum. Curabitur in libero ut massa volutpat convallis. Morbi odio odio, elementum eu, interdum eu, tincidunt in, leo. Maecenas pulvinar lobortis est. Phasellus sit amet erat. Nulla tempus.",http://dummyimage.com/171x100.png/dddddd/000000,5f103fde1336a9c3dcaab8b5166cf9cb8e953d3929b6dc8a10,2025-02-13 03:12:04
b60be71496725858dbda89b7826b1865287d0d4a94385f8f30,"In est risus, auctor sed, tristique in, tempus sit amet, sem. Fusce consequat.",http://dummyimage.com/242x100.png/dddddd/000000,3e789ba777fb55ef372c2aef88484dc829c197de67c7ea0c00,2025-10-19 05:06:37
a4c59fdf5a007e358dbf1c60723ead3a8ec81df967ea50cd64,"Nam congue, risus semper porta volutpat, quam pede lobortis ligula, sit amet eleifend pede libero quis orci. Nullam molestie nibh in lectus. Pellentesque at nulla. Suspendisse potenti. Cras in purus eu magna vulputate luctus. Cum sociis natoque penatibus et magnis dis parturient montes, nascetur ridiculus mus. Vivamus vestibulum sagittis sapien. Cum sociis natoque penatibus et magnis dis parturient montes, nascetur ridiculus mus. Etiam vel augue. Vestibulum rutrum rutrum neque.",http://dummyimage.com/102x100.png/5fa2dd/ffffff,17349fd80eca127803918b0740c9c0a40310dd436fa19284cf,2025-01-03 14:03:04
d75b6f291aa292f583030b9e7b9b5fde86c314548e5b84f6da,Sed vel enim sit amet nunc viverra dapibus. Nulla suscipit ligula in lacus. Curabitur at ipsum ac tellus semper interdum.,http://dummyimage.com/238x100.png/5fa2dd/ffffff,33fa499e153293f2a944b2aa8dd346b0eb3e52e50d3358030f,2025-11-28 15:57:28
9123302188100716d09f08b3883028c6b29654e6159022bfc1,Mauris sit amet eros. Suspendisse accumsan tortor quis turpis. Sed ante. Vivamus tortor. Duis mattis egestas metus. Aenean fermentum.,http://dummyimage.com/197x100.png/cc0000/ffffff,b2e83e280060175bed4f52449075c5aa67af6ca0faf4a031b4,2025-10-30 06:30:19
8cc3e30719a3fcd149be7c4d97fa9d71811a78b2db5140d486,"Cum sociis natoque penatibus et magnis dis parturient montes, nascetur ridiculus mus. Etiam vel augue. Vestibulum rutrum rutrum neque. Aenean auctor gravida sem. Praesent id massa id nisl venenatis lacinia. Aenean sit amet justo.",http://dummyimage.com/158x100.png/cc0000/ffffff,cf358eabc5547df242a16ef2fcc3f8d46277fd78c7d67d4446,2025-03-22 22:32:04
293258efefdfc64a05fba0b8704a677851c2396bc60ca13ae8,Aliquam quis turpis eget elit sodales scelerisque. Mauris sit amet eros. Suspendisse accumsan tortor quis turpis. Sed ante. Vivamus tortor. Duis mattis egestas metus. Aenean fermentum. Donec ut mauris eget massa tempor convallis.,http://dummyimage.com/221x100.png/cc0000/ffffff,f245b39088dd3cf74abb5c118b959341cc3bff78df40be1ad6,2025-11-15 02:36:30
36239fdb441a505b58b6161234659f5f73ed905cfd281a7b1b,"Cras in purus eu magna vulputate luctus. Cum sociis natoque penatibus et magnis dis parturient montes, nascetur ridiculus mus. Vivamus vestibulum sagittis sapien. Cum sociis natoque penatibus et magnis dis parturient montes, nascetur ridiculus mus. Etiam vel augue. Vestibulum rutrum rutrum neque. Aenean auctor gravida sem. Praesent id massa id nisl venenatis lacinia. Aenean sit amet justo. Morbi ut odio.",http://dummyimage.com/139x100.png/dddddd/000000,76ebc793f16ef6bc67b97d13b9248ad6b3acd13396835190a8,2025-09-20 15:18:34
31b0fc325d3c1f7279ba1081bd8879679f7b0d7b8207c736b7,"Morbi non lectus. Aliquam sit amet diam in magna bibendum imperdiet. Nullam orci pede, venenatis non, sodales sed, tincidunt eu, felis. Fusce posuere felis sed lacus. Morbi sem mauris, laoreet ut, rhoncus aliquet, pulvinar sed, nisl. Nunc rhoncus dui vel sem.",http://dummyimage.com/204x100.png/5fa2dd/ffffff,6dbe6b5a8cd69aef2cb02c20b62849837d0b262e70400bcfe7,2025-01-23 05:57:12
8ca9de1658dd528c67ee9169a2de808fe4744ca8c8f9914249,"Quisque ut erat. Curabitur gravida nisi at nibh. In hac habitasse platea dictumst. Aliquam augue quam, sollicitudin vitae, consectetuer eget, rutrum at, lorem. Integer tincidunt ante vel ipsum. Praesent blandit lacinia erat.",http://dummyimage.com/192x100.png/dddddd/000000,f245b39088dd3cf74abb5c118b959341cc3bff78df40be1ad6,2025-07-01 23:59:48
a4117cf706be6a19f9b06a2f0e49a8a0e9f87a5a238e2b841b,Nulla ac enim.,http://dummyimage.com/234x100.png/cc0000/ffffff,06a170e099af36250573dd01e4399fbe46d6522b52f50092f8,2025-10-08 01:50:42
50725b9be7f9c096587f56b4a76e088316efa00eac3003b3d7,In hac habitasse platea dictumst.,http://dummyimage.com/114x100.png/5fa2dd/ffffff,237f69989b148d2a03ec586b5978f17f46423aa1b2d00b39c2,2024-12-15 14:32:41
a1747975f9d92280a22c5c8202129bf893868b9793fd0892b4,"Sed accumsan felis. Ut at dolor quis odio consequat varius. Integer ac leo. Pellentesque ultrices mattis odio. Donec vitae nisi. Nam ultrices, libero non mattis pulvinar, nulla pede ullamcorper augue, a suscipit nulla elit ac nulla. Sed vel enim sit amet nunc viverra dapibus. Nulla suscipit ligula in lacus. Curabitur at ipsum ac tellus semper interdum. Mauris ullamcorper purus sit amet nulla.",http://dummyimage.com/140x100.png/ff4444/ffffff,90d75eb456b6c9b027cd9f566213f9ade22325f1b2cc24c84f,2025-02-13 00:48:59
ad436685110baa1d2547af568d6e226ca4e7ec423579e98777,"Aenean lectus. Pellentesque eget nunc. Donec quis orci eget orci vehicula condimentum. Curabitur in libero ut massa volutpat convallis. Morbi odio odio, elementum eu, interdum eu, tincidunt in, leo. Maecenas pulvinar lobortis est. Phasellus sit amet erat.",http://dummyimage.com/161x100.png/5fa2dd/ffffff,41cb50e9cf0ed9cd2b6ebbb8ef068562683c3584eda8fee301,2025-08-13 00:28:11
4dba2c576bfc1464b88b5aed894c378b58d970b97b699aa541,"Praesent lectus. Vestibulum quam sapien, varius ut, blandit non, interdum in, ante. Vestibulum ante ipsum primis in faucibus orci luctus et ultrices posuere cubilia Curae; Duis faucibus accumsan odio. Curabitur convallis. Duis consequat dui nec nisi volutpat eleifend. Donec ut dolor. Morbi vel lectus in quam fringilla rhoncus. Mauris enim leo, rhoncus sed, vestibulum sit amet, cursus id, turpis. Integer aliquet, massa id lobortis convallis, tortor risus dapibus augue, vel accumsan tellus nisi eu orci.",http://dummyimage.com/126x100.png/cc0000/ffffff,fa24d1fc40c3d92d33ea9bb40f87694b1d377558e0cc5a449f,2025-01-22 21:24:00
c0f4a30a98c71edc347027c314c58a5a001e028ddc0018f78a,"Nulla facilisi. Cras non velit nec nisi vulputate nonummy. Maecenas tincidunt lacus at velit. Vivamus vel nulla eget eros elementum pellentesque. Quisque porta volutpat erat. Quisque erat eros, viverra eget, congue eget, semper rutrum, nulla. Nunc purus.",http://dummyimage.com/170x100.png/dddddd/000000,41cb50e9cf0ed9cd2b6ebbb8ef068562683c3584eda8fee301,2025-03-31 23:39:49
606afe6ddfd3cfadbe086aa684cccdc8ff5e44e1468663ad88,Pellentesque ultrices mattis odio. Donec vitae nisi.,http://dummyimage.com/200x100.png/ff4444/ffffff,04d53f95e2f48d73656c5d015d196689079a3e96abc401a4dd,2025-05-29 04:09:20
ec5ccc5ee41b76b68bac29c90e134422a35a1c13fc97949cfd,Etiam pretium iaculis justo. In hac habitasse platea dictumst. Etiam faucibus cursus urna. Ut tellus. Nulla ut erat id mauris vulputate elementum.,http://dummyimage.com/240x100.png/ff4444/ffffff,06a170e099af36250573dd01e4399fbe46d6522b52f50092f8,2025-06-15 05:16:07
ee42868fdf3ca1399505908f962a783bacdc8eeb3f1e26bb78,Nulla tempus.,http://dummyimage.com/100x100.png/ff4444/ffffff,6742e1e7cc6adfc49c57e2e3f50905e10c158aa4deb7fbfcff,2025-11-12 22:36:12
f7b4e9bee71e3c63029d84f12b89c9bf2fed168e3706ff0127,"Cum sociis natoque penatibus et magnis dis parturient montes, nascetur ridiculus mus. Vivamus vestibulum sagittis sapien. Cum sociis natoque penatibus et magnis dis parturient montes, nascetur ridiculus mus. Etiam vel augue.",http://dummyimage.com/198x100.png/ff4444/ffffff,e326b8b55292ca09e9355ed46a0f56af6136134882f99f5121,2025-04-30 06:34:23
